{
  "schema_version": "alchedata.robotwin_task_program_input.v0",
  "task_id": "task_vegetable_basket",
  "variant": "primary",
  "language_prompt": "put the vegetable into the basket",
  "scene_id": "scene_vegetable_basket_v0",
  "placement_spec": "runs/probe_static_vegetable_basket/final_placement.json",
  "placement_sha256": "1568aeb1652c588f4bf7a0d7ab34e996210b18a1ebd4407fdb8971289e5c06aa",
  "task_binding": {
    "template": "place_in",
    "source_object_id": "vagetable_1",
    "target_object_id": "basket_1"
  },
  "robotwin_adapter": {
    "backend": "RoboTwin/SAPIEN",
    "entrypoint": "scripts/run_generated_selection2env_rollout_probe.py",
    "task_config": "demo_clean",
    "python_env": "/home/jingxiang/miniconda3/envs/robotwin-5090",
    "requires_robotwin_root": true
  },
  "verifier": {
    "type": "simulator_state_and_visual",
    "relation": "in",
    "source_object_id": "vagetable_1",
    "success_conditions": [
      "generated play_once completes without planner failure",
      "simulator-state relation predicate passes",
      "both grippers are open after release",
      "head and observer camera artifacts are nonblank"
    ],
    "target_object_id": "basket_1"
  }
}
